{
  "version": "StrategyRecommendationV1",
  "case_id": "case_escalate",
  "as_of_utc": "20260220T000000Z",
  "inputs": {
    "bundle_path": "fixtures/port2/case_escalate/bundle",
    "model_path": "fixtures/port2/case_escalate/model/payment_plan_model.json",
    "total_liability": 10500,
    "capacity_likely": 720
  },
  "strategy": {
    "type": "CPA_ESCALATION_REQUIRED",
    "recommended_monthly_payment": 0,
    "estimated_months_to_payoff": null,
    "why_this_strategy": [
      "Risk flag present: INCOMPLETE_TAX_DATA",
      "Cannot determine reliable strategy with available data",
      "Recommend consultation with CPA or Enrolled Agent before proceeding"
    ],
    "why_not_others": [
      "All payment plan options require complete and verified tax data"
    ]
  },
  "execution": {
    "documents_needed": [
      "Income verification documents",
      "Housing and utility documentation",
      "Debt statements",
      "Asset documentation",
      "Prior IRS correspondence"
    ],
    "call_script_questions": [
      "Confirm total balance due across all tax years",
      "Request current penalty and interest calculations",
      "Confirm no active liens or levies"
    ]
  },
  "risk_flags": [
    "SELF_EMPLOYMENT_COMPLEXITY",
    "INCOMPLETE_TAX_DATA"
  ],
  "assumptions": [
    "This is a planning estimate based on reported data",
    "Confirm all figures and strategy with a licensed CPA or Enrolled Agent before contacting the IRS",
    "Liability totals from TaxVault bundle export; may not reflect recent payments or adjustments",
    "Monthly capacity from taxpayer-reported income and expenses",
    "Strategy thresholds: short-term <= 6 months, long-term <= 72 months, minimum payment $50"
  ]
}
