{
  "version": "StrategyRecommendationV1",
  "case_id": "case_demo_package",
  "as_of_utc": "20260220T000000Z",
  "inputs": {
    "bundle_path": "fixtures/port3/case_demo_package/bundle",
    "model_path": "fixtures/port3/case_demo_package/model/payment_plan_model.json",
    "total_liability": 5650,
    "capacity_likely": 900
  },
  "strategy": {
    "type": "LONG_TERM_INSTALLMENT_AGREEMENT",
    "recommended_monthly_payment": 900,
    "estimated_months_to_payoff": 7,
    "why_this_strategy": [
      "Total liability of $5650.00 can be paid in 7 months at $900.00/month",
      "Payoff exceeds 6 months but is within 72-month installment agreement window",
      "Standard installment agreement allows structured monthly payments to the IRS"
    ],
    "why_not_others": [
      "Short-term plan not feasible (payoff requires 7 months, exceeds 6-month limit)",
      "Partial payment IA not needed (full payoff achievable within 72 months)"
    ]
  },
  "execution": {
    "documents_needed": [
      "Income verification documents",
      "Housing and utility documentation",
      "Debt statements",
      "Asset documentation",
      "Prior IRS correspondence"
    ],
    "call_script_questions": [
      "Confirm total balance due across all tax years",
      "Request current penalty and interest calculations",
      "Request installment agreement terms and setup fee",
      "Confirm no active liens or levies"
    ]
  },
  "risk_flags": [],
  "assumptions": [
    "This is a planning estimate based on reported data",
    "Confirm all figures and strategy with a licensed CPA or Enrolled Agent before contacting the IRS",
    "Liability totals from TaxVault bundle export; may not reflect recent payments or adjustments",
    "Monthly capacity from taxpayer-reported income and expenses",
    "Strategy thresholds: short-term <= 6 months, long-term <= 72 months, minimum payment $50"
  ]
}
