{
  "version": "StrategyRecommendationV1",
  "case_id": "case_multi_doc",
  "as_of_utc": "20260220T000000Z",
  "inputs": {
    "bundle_path": "fixtures/port3/case_multi_doc/bundle",
    "model_path": "fixtures/port3/case_multi_doc/model/payment_plan_model.json",
    "total_liability": 2400,
    "capacity_likely": 500
  },
  "strategy": {
    "type": "SHORT_TERM_PAYMENT_PLAN",
    "recommended_monthly_payment": 500,
    "estimated_months_to_payoff": 5,
    "why_this_strategy": [
      "Total liability of $2400.00 can be paid in 5 months at $500.00/month",
      "Payoff within 6 months qualifies for short-term payment plan",
      "No setup fee for short-term plans under 180 days"
    ],
    "why_not_others": [
      "Long-term installment agreement not needed (payoff within 6 months)",
      "Partial payment IA not needed (full payoff achievable within 6 months)"
    ]
  },
  "execution": {
    "documents_needed": [
      "Income verification documents",
      "Housing and utility documentation",
      "Debt statements",
      "Asset documentation",
      "Prior IRS correspondence"
    ],
    "call_script_questions": [
      "Confirm total balance due across all tax years",
      "Request current penalty and interest calculations",
      "Request short-term payment plan setup",
      "Confirm no active liens or levies"
    ]
  },
  "risk_flags": [],
  "assumptions": [
    "This is a planning estimate based on reported data",
    "Confirm all figures and strategy with a licensed CPA or Enrolled Agent before contacting the IRS",
    "Liability totals from TaxVault bundle export; may not reflect recent payments or adjustments",
    "Monthly capacity from taxpayer-reported income and expenses",
    "Strategy thresholds: short-term <= 6 months, long-term <= 72 months, minimum payment $50"
  ]
}
